<?xml version="1.0" encoding="UTF-8"?>
<xs:schema xmlns:xs="http://www.w3.org/2001/XMLSchema">
	<xs:element name="list">
		<xs:complexType>
			<xs:sequence maxOccurs="1" minOccurs="1">
				<xs:element name="npc" maxOccurs="1" minOccurs="1">
					<xs:complexType>
						<xs:sequence maxOccurs="1" minOccurs="1">
							<xs:element name="droplist">
								<xs:complexType>
									<xs:sequence maxOccurs="50" minOccurs="1">
										<xs:element name="category">
											<xs:complexType>
												<xs:sequence maxOccurs="100" minOccurs="1">
													<xs:element name="item">
														<xs:complexType>
															<xs:attribute name="id" type="xs:positiveInteger" use="required" />
															<xs:attribute name="min" type="xs:positiveInteger" use="required" />
															<xs:attribute name="max" type="xs:positiveInteger" use="required" />
															<xs:attribute name="chance" type="xs:decimal" use="required" />
														</xs:complexType>
													</xs:element>
												</xs:sequence>
												<xs:attribute name="id" type="xs:positiveInteger" use="required" />
												<xs:attribute name="chance" type="xs:decimal" use="required" />
											</xs:complexType>
										</xs:element>
									</xs:sequence>
								</xs:complexType>
							</xs:element>
							<xs:element minOccurs="0" maxOccurs="unbounded" name="spoillist">
								<xs:complexType>
									<xs:sequence maxOccurs="5" minOccurs="1">
										<xs:element name="item" maxOccurs="100" minOccurs="1">
											<xs:complexType>
												<xs:attribute name="id" type="xs:positiveInteger" use="required" />
												<xs:attribute name="min" type="xs:positiveInteger" use="required" />
												<xs:attribute name="max" type="xs:positiveInteger" use="required" />
												<xs:attribute name="chance" type="xs:decimal" use="required" />
											</xs:complexType>
										</xs:element>
									</xs:sequence>
								</xs:complexType>
							</xs:element>
						</xs:sequence>
						<xs:attribute name="id" type="xs:positiveInteger" use="required" />
					</xs:complexType>
				</xs:element>
			</xs:sequence>
		</xs:complexType>
	</xs:element>
</xs:schema>