<?xml version="1.0" encoding="UTF-8"?>
<list xmlns:xsi="http://www.w3.org/2001/XMLSchema-instance" xsi:noNamespaceSchemaLocation="../../../xsd/DropListData.xsd">
<!-- Воин Орков Вуку -->
<npc id="20017">
	<droplist>
		<category id="1" chance="70.000">
			<item id="57" min="122" max="197" chance="100.00000" />		<!-- Адена -->
		</category>
		<category id="2" chance="0.236">
			<item id="2" min="1" max="1" chance="2.98651" />		<!-- Длинный Меч -->
			<item id="120" min="1" max="1" chance="2.98651" />		<!-- Меч Отражения -->
			<item id="2012" min="1" max="1" chance="32.66485" />		<!-- Клинок Меча Отражения -->
			<item id="121" min="1" max="1" chance="2.98651" />		<!-- Меч Темной Воды -->
			<item id="415" min="1" max="1" chance="12.69036" />		<!-- Усиленные Мифрилом Набедренники -->
			<item id="416" min="1" max="1" chance="12.69036" />		<!-- Укрепленные Кожаные Набедренники -->
			<item id="186" min="1" max="1" chance="1.26904" />		<!-- Посох Магии -->
			<item id="1950" min="1" max="1" chance="31.72589" />		<!-- Заготовка Полулат -->
		</category>
		<category id="3" chance="15.176">
			<item id="34991" min="1" max="1" chance="24.42742" /> <!-- Обломок Доспеха -->
			<item id="34992" min="1" max="1" chance="31.71534" /> <!-- Драгоценные Аксессуары -->
			<item id="1817" min="1" max="1" chance="4.88550" />		<!-- Рецепт - Веревка -->
			<item id="5268" min="1" max="1" chance="0.97703" />		<!-- Рецепт - Суперкомпактная Упаковка: Заряды Души Ранг D (100%) -->
			<item id="1061" min="1" max="1" chance="32.55842" />		<!-- Большое Зелье Исцеления -->
			<item id="1878" min="1" max="1" chance="7.28792" />		<!-- Плетеный Лен -->
			<item id="1882" min="1" max="1" chance="4.94208" />		<!-- Кожа -->
			<item id="956" min="1" max="1" chance="0.49421" />		<!-- Свиток: Модифицировать Доспех (D) -->
		</category>
	</droplist>
	<spoillist>
			<item id="1897" min="1" max="1" chance="5.97620" />		<!-- Цепочка Ожерелья Мудрости -->
	</spoillist>
</npc>
</list>
