<?xml version="1.0" encoding="UTF-8"?>
<list xmlns:xsi="http://www.w3.org/2001/XMLSchema-instance" xsi:noNamespaceSchemaLocation="../../../xsd/DropListData.xsd">
<!-- Ядро -->
<npc id="29006">
	<droplist>
		<category id="1" chance="40">
			<item id="75" min="1" max="1" chance="12"/> <!-- Экскалибур -->
			<item id="84" min="1" max="1" chance="10"/> <!-- Меч Гомункула -->
			<item id="162" min="1" max="1" chance="12"/> <!-- Топор Войны -->
			<item id="174" min="1" max="1" chance="10"/> <!-- Топор Нирваны -->
			<item id="200" min="1" max="1" chance="10"/> <!-- Посох Мудреца -->
			<item id="233" min="1" max="1" chance="12"/> <!-- Кинжал Тьмы -->
			<item id="265" min="1" max="1" chance="10"/> <!-- Кастетные Клинки -->
			<item id="283" min="1" max="1" chance="12"/> <!-- Длинный Лук Аката -->
			<item id="301" min="1" max="1" chance="12"/> <!-- Скорпион -->
		</category>
		<category id="2" chance="60">
			<item id="60" min="1" max="1" chance="20"/> <!-- Композитный Доспех -->
			<item id="400" min="1" max="1" chance="20"/> <!-- Кожаный Доспех Тека -->
			<item id="420" min="1" max="1" chance="20"/> <!-- Кожаные Набедренники Тека -->
			<item id="441" min="1" max="1" chance="20"/> <!-- Туника Демона -->
			<item id="472" min="1" max="1" chance="20"/> <!-- Штаны Демона -->
		</category>
		<category id="3" chance="70">
			<item id="517" min="1" max="1" chance="20"/> <!-- Композитный Шлем -->
			<item id="2435" min="1" max="1" chance="20"/> <!-- Сапоги Демона -->
			<item id="2459" min="1" max="1" chance="20"/> <!-- Перчатки Демона -->
			<item id="107" min="1" max="1" chance="20"/> <!-- Композитный Щит -->
			<item id="951" min="1" max="1" chance="20"/> <!-- Свиток: Модифицировать Оружие (С) -->
		</category>
		<category id="4" chance="100">
			<item id="57" min="100000" max="150000" chance="100"/> <!-- Адена -->
		</category>
		<category id="5" chance="100">
			<item id="57" min="100000" max="150000" chance="100"/> <!-- Адена -->
		</category>
		<category id="6" chance="100">
			<item id="57" min="100000" max="150000" chance="100"/> <!-- Адена -->
		</category>
		<category id="7" chance="100">
			<item id="57" min="100000" max="150000" chance="100"/> <!-- Адена -->
		</category>
		<category id="8" chance="100">
			<item id="57" min="100000" max="150000" chance="100"/> <!-- Адена -->
		</category>
		<category id="9" chance="100">
			<item id="8744" min="2" max="4" chance="45"/> <!-- Камень Жизни Высокого Качества - Уровень 49 -->
			<item id="8745" min="2" max="4" chance="40"/> <!-- Камень Жизни Высокого Качества - Уровень 52 -->
			<item id="8754" min="1" max="2" chance="10"/> <!-- Камень Жизни Высшего Качества - Уровень 49 -->
			<item id="8755" min="1" max="2" chance="5"/> <!-- Камень Жизни Высшего Качества - Уровень 52 -->
		</category>
		<category id="10" chance="30">
			<item id="6662" min="1" max="1" chance="100"/> <!-- Кольцо Ядра -->
		</category>
	</droplist>
</npc>
</list>
